{
  "id": "AR-SALES-20260225-001",
  "work_packet_id": "WP-SALES-20260225-001",
  "changeset_id": "CS-SALES-20260225-001",
  "classification": "PASS",
  "summary": "CHANGESET CS-SALES-20260225-001 passes all verification duties. Envelope fields match WORK_PACKET (change_type=feature, architectural_flag=false, requires_pressure_test=false). All 4 modified_paths are within allowed_paths. No protected assets modified. No backbone primitives redefined. Altitude hierarchy respected (5k Execution). Implementation correctly wires Meeting1.tsx to persist 4 declared columns (employer_name, employee_count, renewal_month, prior_broker) to sales.sales_factfinder via the data layer. IMO flow enforced: Ingress (Zod validation in UI) → Middle (service.ts orchestrates mint/upsert/error-log) → Egress (toast only). CTB branch placement correct: types in data/, queries in data/, service in app/, page in ui/. No direct Supabase imports in UI. No forbidden folders created.",
  "doctrine_version": "3.3.0",
  "timestamp": "2026-02-25T12:45:00Z"
}
